{
  "framework_compatibility": [
    {
      "source_id": "pytorch-version-compatibility",
      "torch_series": "1.2",
      "torchaudio_series": "0.3",
      "torchvision_series": "0.4"
    },
    {
      "source_id": "pytorch-version-compatibility",
      "torch_series": "1.3",
      "torchaudio_series": "0.3",
      "torchvision_series": "0.4"
    },
    {
      "source_id": "pytorch-version-compatibility",
      "torch_series": "1.4",
      "torchaudio_series": "0.4",
      "torchvision_series": "0.5"
    },
    {
      "source_id": "pytorch-version-compatibility",
      "torch_series": "1.5",
      "torchaudio_series": "0.5",
      "torchvision_series": "0.6"
    },
    {
      "source_id": "pytorch-version-compatibility",
      "torch_series": "1.6",
      "torchaudio_series": "0.6",
      "torchvision_series": "0.7"
    },
    {
      "source_id": "pytorch-version-compatibility",
      "torch_series": "1.7",
      "torchaudio_series": "0.7",
      "torchvision_series": "0.8"
    },
    {
      "source_id": "pytorch-version-compatibility",
      "torch_series": "1.8",
      "torchaudio_series": "0.8",
      "torchvision_series": "0.9"
    },
    {
      "source_id": "pytorch-version-compatibility",
      "torch_series": "1.9",
      "torchaudio_series": "0.9",
      "torchvision_series": "0.10"
    },
    {
      "source_id": "pytorch-version-compatibility",
      "torch_series": "1.10",
      "torchaudio_series": "0.10",
      "torchvision_series": "0.11"
    },
    {
      "source_id": "pytorch-version-compatibility",
      "torch_series": "1.11",
      "torchaudio_series": "0.11",
      "torchvision_series": "0.12"
    },
    {
      "source_id": "pytorch-version-compatibility",
      "torch_series": "1.12",
      "torchaudio_series": "0.12",
      "torchvision_series": "0.13"
    },
    {
      "source_id": "pytorch-version-compatibility",
      "torch_series": "1.13",
      "torchaudio_series": "0.13",
      "torchvision_series": "0.14"
    },
    {
      "source_id": "pytorch-version-compatibility",
      "torch_series": "2.0",
      "torchaudio_series": "2.0",
      "torchvision_series": "0.15"
    },
    {
      "source_id": "pytorch-version-compatibility",
      "torch_series": "2.1",
      "torchaudio_series": "2.1",
      "torchvision_series": "0.16"
    },
    {
      "source_id": "pytorch-version-compatibility",
      "torch_series": "2.2",
      "torchaudio_series": "2.2",
      "torchvision_series": "0.17"
    },
    {
      "source_id": "pytorch-version-compatibility",
      "torch_series": "2.3",
      "torchaudio_series": "2.3",
      "torchvision_series": "0.18"
    },
    {
      "source_id": "pytorch-version-compatibility",
      "torch_series": "2.4",
      "torchaudio_series": "2.4",
      "torchvision_series": "0.19"
    },
    {
      "source_id": "pytorch-version-compatibility",
      "torch_series": "2.5",
      "torchaudio_series": "2.5",
      "torchvision_series": "0.20"
    },
    {
      "source_id": "pytorch-version-compatibility",
      "torch_series": "2.6",
      "torchaudio_series": "2.6",
      "torchvision_series": "0.21"
    },
    {
      "source_id": "pytorch-version-compatibility",
      "torch_series": "2.7",
      "torchaudio_series": "2.7",
      "torchvision_series": "0.22"
    },
    {
      "source_id": "pytorch-version-compatibility",
      "torch_series": "2.8",
      "torchaudio_series": "2.7",
      "torchvision_series": "0.22"
    },
    {
      "source_id": "pytorch-version-compatibility",
      "torch_series": "2.9",
      "torchaudio_series": "2.9",
      "torchvision_series": "0.24"
    },
    {
      "source_id": "pytorch-version-compatibility",
      "torch_series": "2.10",
      "torchaudio_series": "2.10",
      "torchvision_series": "0.25"
    },
    {
      "source_id": "therock-release-packaging",
      "torch_series": "2.11",
      "torchaudio_series": "2.11",
      "torchvision_series": "0.26"
    },
    {
      "source_id": "therock-release-packaging",
      "torch_series": "2.12",
      "torchaudio_series": "2.11",
      "torchvision_series": "0.27"
    },
    {
      "source_id": "therock-release-packaging",
      "torch_series": "2.13",
      "torchaudio_series": "2.11",
      "torchvision_series": "0.28"
    },
    {
      "source_id": "therock-release-packaging",
      "torch_series": "2.14",
      "torchaudio_series": "2.11",
      "torchvision_series": "0.29"
    }
  ],
  "last_observed_at": "2026-10-18T19:07:55Z",
  "platforms": {
    "linux": {
      "release_support": [],
      "therock_status": []
    },
    "windows": {
      "release_support": [
        {
          "adrenalin_driver_versions": [
            "26.10.41.05"
          ],
          "device_family": "radeon",
          "gfx": "gfx1030",
          "rocm_version": "10.1.0",
          "selector_ids": [
            "amd-radeon-pro-v620",
            "amd-radeon-pro-w6800"
          ],
          "source_id": "rocm-compatibility-matrix",
          "windows_oem_driver_versions": [],
          "windows_versions": [
            "Windows 11 25H2"
          ]
        },
        {
          "adrenalin_driver_versions": [
            "26.10.41.05"
          ],
          "device_family": "radeon",
          "gfx": "gfx1100",
          "rocm_version": "10.1.0",
          "selector_ids": [
            "amd-radeon-pro-w7800",
            "amd-radeon-pro-w7800-48gb",
            "amd-radeon-pro-w7900",
            "amd-radeon-pro-w7900-dual-slot",
            "amd-radeon-rx-7900-gre",
            "amd-radeon-rx-7900-xt",
            "amd-radeon-rx-7900-xtx"
          ],
          "source_id": "rocm-compatibility-matrix",
          "windows_oem_driver_versions": [],
          "windows_versions": [
            "Windows 11 25H2"
          ]
        },
        {
          "adrenalin_driver_versions": [
            "26.10.41.05"
          ],
          "device_family": "radeon",
          "gfx": "gfx1101",
          "rocm_version": "10.1.0",
          "selector_ids": [
            "amd-radeon-pro-v710",
            "amd-radeon-pro-w7700",
            "amd-radeon-rx-7700",
            "amd-radeon-rx-7700-xt",
            "amd-radeon-rx-7800-xt"
          ],
          "source_id": "rocm-compatibility-matrix",
          "windows_oem_driver_versions": [],
          "windows_versions": [
            "Windows 11 25H2"
          ]
        },
        {
          "adrenalin_driver_versions": [
            "26.10.41.05"
          ],
          "device_family": "radeon",
          "gfx": "gfx1102",
          "rocm_version": "10.1.0",
          "selector_ids": [
            "amd-radeon-rx-7600"
          ],
          "source_id": "rocm-compatibility-matrix",
          "windows_oem_driver_versions": [],
          "windows_versions": [
            "Windows 11 25H2"
          ]
        },
        {
          "adrenalin_driver_versions": [
            "26.10.41.05"
          ],
          "device_family": "ryzen",
          "gfx": "gfx1103",
          "rocm_version": "10.1.0",
          "selector_ids": [
            "gfx1103"
          ],
          "source_id": "rocm-compatibility-matrix",
          "windows_oem_driver_versions": [],
          "windows_versions": [
            "Windows 11 25H2"
          ]
        },
        {
          "adrenalin_driver_versions": [
            "26.10.41.05"
          ],
          "device_family": "ryzen",
          "gfx": "gfx1150",
          "rocm_version": "10.1.0",
          "selector_ids": [
            "gfx1150"
          ],
          "source_id": "rocm-compatibility-matrix",
          "windows_oem_driver_versions": [],
          "windows_versions": [
            "Windows 11 25H2"
          ]
        },
        {
          "adrenalin_driver_versions": [
            "26.10.41.05"
          ],
          "device_family": "ryzen",
          "gfx": "gfx1151",
          "rocm_version": "10.1.0",
          "selector_ids": [
            "gfx1151"
          ],
          "source_id": "rocm-compatibility-matrix",
          "windows_oem_driver_versions": [],
          "windows_versions": [
            "Windows 11 25H2"
          ]
        },
        {
          "adrenalin_driver_versions": [
            "26.10.41.05"
          ],
          "device_family": "ryzen",
          "gfx": "gfx1152",
          "rocm_version": "10.1.0",
          "selector_ids": [
            "gfx1152"
          ],
          "source_id": "rocm-compatibility-matrix",
          "windows_oem_driver_versions": [],
          "windows_versions": [
            "Windows 11 25H2"
          ]
        },
        {
          "adrenalin_driver_versions": [
            "26.10.41.05"
          ],
          "device_family": "ryzen",
          "gfx": "gfx1153",
          "rocm_version": "10.1.0",
          "selector_ids": [
            "gfx1153"
          ],
          "source_id": "rocm-compatibility-matrix",
          "windows_oem_driver_versions": [],
          "windows_versions": [
            "Windows 11 25H2"
          ]
        },
        {
          "adrenalin_driver_versions": [
            "26.10.41.05"
          ],
          "device_family": "radeon",
          "gfx": "gfx1200",
          "rocm_version": "10.1.0",
          "selector_ids": [
            "amd-radeon-rx-9050",
            "amd-radeon-rx-9050-(4gb)",
            "amd-radeon-rx-9060",
            "amd-radeon-rx-9060-xt",
            "amd-radeon-rx-9060-xt-lp"
          ],
          "source_id": "rocm-compatibility-matrix",
          "windows_oem_driver_versions": [],
          "windows_versions": [
            "Windows 11 25H2"
          ]
        },
        {
          "adrenalin_driver_versions": [
            "26.10.41.05"
          ],
          "device_family": "radeon",
          "gfx": "gfx1201",
          "rocm_version": "10.1.0",
          "selector_ids": [
            "amd-radeon-ai-pro-r9600",
            "amd-radeon-ai-pro-r9600d",
            "amd-radeon-ai-pro-r9700",
            "amd-radeon-ai-pro-r9700s",